<?xml version="1.0" encoding="UTF-8"?>
<beans xmlns="http://www.fireflysource.com/beans"
       xmlns:xsi="http://www.w3.org/2001/XMLSchema-instance"
       xsi:schemaLocation="http://www.fireflysource.com/beans http://www.fireflysource.com/beans.xsd">

    <component-scan base-package="com.firefly.kotlin.ext.context" />
    <component-scan base-package="com.firefly.kotlin.ext.example.task.management" />

    <bean id="dataSource" class="com.zaxxer.hikari.HikariDataSource">
        <property name="jdbcUrl" value="jdbc:h2:mem:test" />
        <property name="driverClassName" value="org.h2.Driver" />
        <property name="isAutoCommit" value="false" />
    </bean>

    <bean id="jdbcClient" class="com.firefly.db.jdbc.JDBCClient" destroy-method="stop">
        <constructor>
            <argument type="javax.sql.DataSource" ref="dataSource"/>
        </constructor>
    </bean>

    <bean id="httpCoroutineLocal" class="com.firefly.kotlin.ext.common.CoroutineLocal"/>

    <bean id="asyncHttpContextTransactionalManager" class="com.firefly.kotlin.ext.db.AsyncHttpContextTransactionalManager">
        <constructor>
            <argument type="com.firefly.kotlin.ext.common.CoroutineLocal" ref="httpCoroutineLocal"/>
            <argument type="com.firefly.db.SQLClient" ref="jdbcClient"/>
        </constructor>
    </bean>

</beans>
