<?xml version="1.0" encoding="UTF-8"?>
<beans xmlns="http://www.fireflysource.com/beans"
       xmlns:xsi="http://www.w3.org/2001/XMLSchema-instance"
       xsi:schemaLocation="http://www.fireflysource.com/beans http://www.fireflysource.com/beans.xsd">

    <bean id="collectionService" class="test.component3.CollectionService">
        <property name="list">
            <list>
                <value>s1</value>
                <value>s2</value>
            </list>
        </property>
        <property name="set">
            <list>
                <value type="int">3</value>
                <value type="int">3</value>
                <value type="java.lang.String">4sss</value>
            </list>
        </property>
    </bean>

    <!-- <bean id="collectionService" class="test.component3.CollectionService">
        <property name="list">
            <list>
                <value>s1</value>
                <value>s2</value>
                <list type="java.util.HashSet">
                    <value>s3</value>
                    <value>s4</value>
                    <value>s4</value>
                </list>
            </list>
        </property>
        <property name="set">
            <list>
                <value type="int">3</value>
                <value type="int">3</value>
                <value type="int">4</value>
            </list>
        </property>
    </bean> -->

</beans>
