<?xml version="1.0" encoding="UTF-8"?>
<beans xmlns="http://www.fireflysource.com/beans"
       xmlns:xsi="http://www.w3.org/2001/XMLSchema-instance"
       xsi:schemaLocation="http://www.fireflysource.com/beans http://www.fireflysource.com/beans.xsd">

    <import resource="testImport1.xml"/>

    <bean id="person" class="test.component3.Person">
        <property name="name" value="Jack"/>
        <property name="age" value="12"/>
    </bean>
    <bean id="person2" class="test.component3.Person">
        <property name="name">
            <value>Bob</value>
        </property>
        <property name="age" value="32"/>
    </bean>

</beans>
